### ISSUE TITLE
Why ws.close() takes 30sec while all other call ws.* are instantaneous ?

### ISSUE THREAD

**Issue by Cyazd** [websockets/ws#2257]
### Is there an existing issue for this?

- [X] I've searched for any related issues and avoided creating a duplicate issue.

### Description

I'm developing a webapp in React with a backend in NodeJS on an Apache server. One feature of this webapp is a chat app using websocket (I'm not using socket.io for it). Everything worked fine on my local machine : I used wampserver to set up a local server and did everything in ws and http.

Now that I moved everything on my server, 99% of the websocket communications works fine. The 1% comes when I try to close the websocket on React. On my local machine ws.close() was instantaneous. On my server it takes 30sec.

I've been trying to find out where the issue comes from. I've looked at :

- the apache server, but didn't understand how it would be that as all message go through it without problem except for that ws.close().

- replacing ws.terminante() instead of ws.close(), but when a user refreshes his webpage, a ws.close() is still sent.

- try to send a specific message to the server to initiate the close / terminate, but the still couldn't bypass the case where the user refreshes his page.

Here's a snippet of a code that creates the websocket on the frontend :

```javascript

useEffect(() => {
        const establishConnection = async () => {
            if (user?.id !== undefined && grade !== undefined) {
                await establishNewSocket();
            }
        };
        establishConnection();
    }, [user, grade]);
    
async function establishNewSocket() {
        if (socket && socket?.readyState === WebSocket.OPEN) {
            socket.close(1000);
        }

        const newSocket = new WebSocket(`xxxxxx/chat`);
        setSocket(newSocket);

        newSocket.addEventListener('open', async () => {
            try {
                    newSocket.send(JSON.stringify({ type: 'authenticate', token }));
                    newSocket.send(JSON.stringify({ type: 'firstConnection' }));
            } catch (error) {
                if (socket && socket?.readyState === WebSocket.OPEN) {
                    socket.close(3000);
                }
            }
            connection_resolvers.forEach(r => r.resolve());
        });

        // Gestion des erreurs WebSocket
        newSocket.addEventListener('error', (error) => {
            console.error('Error WebSocket', error);
        });

        // Gestion de la fermeture du WebSocket
        newSocket.addEventListener('close', (event) => {
        });
    }

```

Here's another snippet of a code that triggers the closing of the websocket :

```javascript
const handleLogout = async () => {
  try {
    if (socket && socket?.readyState === WebSocket.OPEN) {
       socket.close(1000);
     }
     navigate('/login');
  } catch (error) {
    console.error('Logout error:', error);
  }
};
```

And here's the backend code :

- index.js

```javascript
const express = require('express');
const cors = require('cors');
const http = require('http');
const helmet = require('helmet');
const cookieParser = require('cookie-parser');
const cron = require('node-cron');

const app = express();
const port = 8001;

app.use(express.json());

app.use(express.urlencoded({ extended: true }));

app.use(helmet());
app.use(cookieParser());

app.use(cors({
  origin: process.env.CORS_ORIGIN,
  methods: ['PUT', 'POST', 'DELETE', 'GET'],
  allowedHeaders: ['Content-Type', 'Authorization'],
  credentials: true  // Permet l'envoi des cookies
}));

const server = http.createServer(app);
const webSocketController = require('./controllers/webSocketController');
webSocketController(server);

```

- a snippet of webSocketController.js

```javascript
const WebSocket = require('ws');
const jwt = require('jsonwebtoken');

const roomsAndUsers = {};

module.exports = (server) => {
    const wss = new WebSocket.Server({ server, path: '/chat' });

    wss.on('connection', (ws, req) => {

        ws.on('message', (messageAsString) => {
            const message = JSON.parse(messageAsString);

            if (message.type === 'authenticate') {
                handleAuthentication(ws, message.token);  // Authentification avec le token JWT
            } else if (ws.user) {
                ...
            } else {
                ws.send(JSON.stringify({ type: 'authError' }));
                ws.close(); 
            }
        });

        ws.on('close', () => {
            if (ws.user) {
                handleDisconnect(ws, `${room}`);
            }
        });
    });

    console.log("WebSocket server is running on the server");

function handleDisconnect(ws, room_variable_name) {
    ws.close();
    ....
};
```

And in case that would be useful, here's a snippet of the ssl.conf file :

```
<VirtualHost _default_:443>
   DocumentRoot xxx
   ServerName xxx
   SSLEngine ON
   SSLCertificateFile xxx
   SSLCertificateKeyFile xxx
   SSLCertificateChainFile xxx

    ProxyPass "/api" "http://localhost:8001/api"
    ProxyPassReverse "/api" "http://localhost:8001/api"

    ProxyPass "/chat" "ws://localhost:8001/chat"
    ProxyPassReverse "/chat" "ws://localhost:8001/chat"

</VirtualHost>
```

I hope someone can help me on this.

Thanking you all in advance.

### ws version

8.8.1

### Node.js Version

16.20.2

### System

OS: Linux 3.10 CentOS Linux 7 (Core)
    CPU: (1) x64 Intel(R) Xeon(R) Silver 4214 CPU @ 2.20GHz
    Memory: 747.43 MB / 1.00 GB
    Container: Yes
    Shell: 4.2.46 - /bin/bash

**Comment by lpinca** [comment]
Maybe the remote peer does not complete the closing handshake so the connection is terminated 30 seconds after `websocket.close()` is called.

https://github.com/websockets/ws/blob/976c53c4065c49ede73bfba824caf5a6e0f290cb/lib/websocket.js#L332

**Comment by Cyazd** [comment]
Thank you for your answer. That's what I thought as this 30sec delay is only featured in the ws code and nowhere else. Besides if the backend initiates a close, even after 30sec, that means that it received the close request. So, as far as I understand, the frontend never receives the response by the server.

For the moment, the frontend creates a websocket at wss://myadress.com/chat and I've configured Apache with a Proxy like that :

```
ProxyPass /chat ws://localhost:8001/chat
ProxyPassReverse /chat ws://localhost:8001/chat
```
    
So that Apache sends all request from /chat to the websocket server configured in NodeJS with
 
```javascript
const server = http.createServer(app);
const wss = new WebSocket.Server({ server, path: '/chat' });
```

I'm leaning toward the apache config file, more precisely in the ProxyPassReverse function, but I don't have enough knowledge to know if I'm right. I presume that ProxyPassReverse doesn't deal adequately when it comes to the close request. But chances that I'm wrong...

**Comment by Cyazd** [comment]
I've tried numerous tests. One seems interesting : on the frontend, instead of a ws.close() where :

```javascript
const ws = new WebSocket ('wss://xxx/chat')
```

I send a message to the backend letting it deal with the disconnection. Once the backend does a ws.close(), I see that the 'close' listener I added for the WebSocket on the frontend :

```javascript
socket.addEventListener('close', (event) => {
       console.log('Socket was closed on the backend')
        });
```
is fired almost instantaneously. So the communication is alright. However the same listener in the backend :

```javascript
ws.on('close', () => {
       console.log('Socket close in the backend');
});
```

is triggered 30 seconds after I received the message on the backend.

Trying to fit the pieces together it seems to me that I need to understand precisely how the closing handshake precisely works, and see maybe if it doesn't get lost because my Apache server uses wrongly a Proxy to redirect the ws messages to a NodeJS server.

**Comment by lpinca** [comment]
> I need to understand precisely how the closing handshake precisely works

The underlying socket is closed when a close frame (which is sent by `websocket.close()` ) is both sent and received.

**Comment by lpinca** [comment]
If you can reproduce it that easily, try to capture the traffic with wireshark/tcpdump and see if the close frame is both sent and received on the server.

**Comment by Cyazd** [comment]
Thanks again for your answer.

Here's what I got from tcpdump when the client launch the websocket close :

```
96	17.182852	::1	::1	WebSocket	96	WebSocket Connection Close [FIN] [MASKED]
97	17.183309	::1	::1	WebSocket	92	WebSocket Connection Close [FIN] 
```

It seems to me that everything is alright (the client sends the Connection Close and the server responds with its own). Am I missing something ?

**Comment by lpinca** [comment]
What happens to the TCP connection after that? The above scenario should lead to

https://github.com/websockets/ws/blob/976c53c4065c49ede73bfba824caf5a6e0f290cb/lib/websocket.js#L328

Is the client also closing the socket?

**Comment by Cyazd** [comment]
> What happens to the TCP connection after that?

Here's what happens just after (sorry for the whole extract, I don't know which one is relevant) :

```
99	17.183374	x.x.x.server	x.x.x.client	TLSv1.2	89	Application Data
100	17.183618	::1	::1	TCP	88	8001 → 60222 [FIN, ACK] Seq=244 Ack=2116 Win=178176 Len=0 TSval=1119877816 TSecr=1119877815
101	17.183747	x.x.x.server	x.x.x.client	TCP	56	443 → 55400 [FIN, ACK] Seq=497 Ack=4130 Win=53248 Len=0
102	17.219770	x.x.x.client	x.x.x.server	TCP	56	55400 → 443 [ACK] Seq=4130 Ack=498 Win=130816 Len=0
103	17.220751	x.x.x.client	x.x.x.server	TCP	56	55400 → 443 [FIN, ACK] Seq=4130 Ack=498 Win=130816 Len=0
104	17.220801	x.x.x.server	x.x.x.client	TCP	56	443 → 55400 [ACK] Seq=498 Ack=4131 Win=53248 Len=0
105	17.223495	::1	::1	TCP	88	60222 → 8001 [ACK] Seq=2116 Ack=245 Win=45056 Len=0 TSval=1119877856 TSecr=1119877816
106	17.688629	::1	::1	TCP	96	36326 → 80 [SYN] Seq=0 Win=43690 Len=0 MSS=65476 SACK_PERM TSval=1119878321 TSecr=0 WS=2048
107	17.688671	::1	::1	TCP	96	80 → 36326 [SYN, ACK] Seq=0 Ack=1 Win=43690 Len=0 MSS=65476 SACK_PERM TSval=1119878321 TSecr=1119878321 WS=2048
108	17.688682	::1	::1	TCP	88	36326 → 80 [ACK] Seq=1 Ack=1 Win=45056 Len=0 TSval=1119878321 TSecr=1119878321
109	17.688701	::1	::1	HTTP	204	OPTIONS * HTTP/1.0 
110	17.688714	::1	::1	TCP	88	80 → 36326 [ACK] Seq=1 Ack=117 Win=45056 Len=0 TSval=1119878321 TSecr=1119878321
111	17.688742	::1	::1	TCP	88	36326 → 80 [FIN, ACK] Seq=117 Ack=1 Win=45056 Len=0 TSval=1119878321 TSecr=1119878321
112	17.688889	::1	::1	HTTP	244	HTTP/1.1 200 OK 
113	17.688901	::1	::1	TCP	76	36326 → 80 [RST] Seq=118 Win=0 Len=0
114	17.694719	::1	::1	TCP	88	39460 → 8001 [FIN, ACK] Seq=1 Ack=1 Win=88 Len=0 TSval=1119878327 TSecr=1119601898
115	17.694770	::1	::1	TCP	76	8001 → 39460 [RST] Seq=1 Win=0 Len=0
```

> Is the client also closing the socket?

In the client code I have : 

```javascript
socket.addEventListener('close', (event) => {
       console.log('Socket was closed on the frontend')
});
```

When I close the socket, this event is fired instantaneously.

**Comment by lpinca** [comment]
It seems correct, I see nothing wrong. What I would do is temporarily bypass the proxy and see if the issue persists. For example, I would start a simple WebSocket server on a different port on the same machine and make the client connect to this server.

**Comment by lpinca** [comment]
```
100	17.183618	::1	::1	TCP	88	8001 → 60222 [FIN, ACK] Seq=244 Ack=2116 Win=178176 Len=0 TSval=1119877816 TSecr=1119877815
```

I think this is the server sent fin but I don't see anything else coming from the client (60222 -> 8001) apart from an ACK so my guess is that the proxy connection is not closed.

**Comment by Cyazd** [comment]
Thank you very much. Following your lead, I changed my ssl.conf file in Apache and added ```SetEnv proxy-nokeepalive 1``` and it works now.

I don't know though if it can be considered as a viable solution...

**Comment by lpinca** [comment]
I don't have much experience with Apache as a reverse proxy for WebSocket. I usually use Nginx or Caddy.

**Comment by lpinca** [comment]
I'm closing this as answered.
